{
    "ZeraActualValues": [
        {
            "EntityId": 1040,
            "Comment": "RMSModule"
        },
        {
            "EntityId": 1050,
            "Comment": "DFTModule"
        },
        {
            "EntityId": 1110,
            "Comment": "THDNModule"
        },
        {
            "EntityId": 1111,
            "Comment": "THDNModule"
        },
        {
            "EntityId": 1070,
            "Comment": "PowerModule"
        },
        {
            "EntityId": 1071,
            "Comment": "PowerModule"
        },
        {
            "EntityId": 1072,
            "Comment": "PowerModule"
        },
        {
            "EntityId": 1090,
            "Comment": "PowerModule CED"
        },
        {
            "EntityId": 1020,
            "Comment": "RangeModule"
        },
        {
            "EntityId": 1140,
            "Comment": "LambdaModule"
        }
    ],
    "ZeraHarmonics" : [
        {
            "EntityId": 1110,
            "Comment": "THDNModule"
        },
        {
            "EntityId": 1060,
            "Comment": "FFTModule"
        },
        {
            "EntityId": 1020,
            "Comment": "RangeModule"
        },
        {
            "EntityId": 1100,
            "Comment": "POWER3Module"
        }
    ],
    "ZeraCurves" : [
        {
            "EntityId": 1120,
            "Comment": "OSCIModule"
        },
        {
            "EntityId": 1020,
            "Comment": "RangeModule"
        }
    ],
    "ZeraSourceControl": [
        {
            "EntityId": 1300,
            "Comment": "SourceModule"
        }
    ]
}
