{
    "ZeraActualValues": [
        {
            "EntityId": 1020,
            "Comment": "RangeModule"
        },
        {
            "EntityId": 1040,
            "Comment": "RMSModule"
        },
        {
            "EntityId": 1050,
            "Comment": "DftModule"
        },
        {
            "EntityId": 1060,
            "Comment": "FFTModule"
        },
        {
            "EntityId": 1070,
            "Comment": "Power1Module P"
        },
        {
            "EntityId": 1071,
            "Comment": "Power1Module Q"
        },
        {
            "EntityId": 1072,
            "Comment": "Power1Module S"
        },
        {
            "EntityId": 1140,
            "Comment": "LambdaModule"
        }
    ],
    "ZeraHarmonics" : [
        {
            "EntityId": 1020,
            "Comment": "RangeModule"
        },
        {
            "EntityId": 1060,
            "Comment": "FFTModule"
        },
        {
            "EntityId": 1110,
            "Comment": "THDNModule1"
        },
        {
            "EntityId": 1111,
            "Comment": "THDNModule2"
        }
    ],
    "ZeraCurves" : [
        {
            "EntityId": 1020,
            "Comment": "RangeModule"
        },
        {
            "EntityId": 1120,
            "Comment": "OSCIModule"
        }
    ],
    "ZeraComparison": [
        {
            "EntityId": 1020,
            "Comment": "RangeModule"
        },
        {
            "EntityId": 1040,
            "Comment": "RMSModule"
        },
        {
            "EntityId": 1050,
            "Comment": "DFTModule"
        },
        {
            "EntityId": 1070,
            "Comment": "Power1Module P"
        },
        {
            "EntityId": 1071,
            "Comment": "Power1Module Q"
        },
        {
            "EntityId": 1072,
            "Comment": "Power1Module S"
        },
        {
            "EntityId": 1110,
            "Comment": "THDNModule1"
        },
        {
            "EntityId": 1111,
            "Comment": "THDNModule2"
        },
        {
            "EntityId": 1130,
            "Comment": "SECModule"
        },
        {
            "EntityId": 1140,
            "Comment": "LambdaModule"
        },
        {
            "EntityId": 1200,
            "Comment": "SEMModule"
        },
        {
            "EntityId": 1800,
            "Comment": "RecorderModule"
        }
    ]
}
